{
  "spec": "authorized-retailers/0.1",
  "form": "full",
  "brand": {
    "name": "Example Brand",
    "domain": "examplebrand.com"
  },
  "issued": "2026-09-23T00:00:00.123Z",
  "expires": "2026-12-22T00:00:00Z",
  "authorizations": [
    {
      "id": "auth_01J9X2",
      "retailer": {
        "name": "Example Retail LLC",
        "entity_id": "ent_7Q4M"
      },
      "channels": [
        {
          "type": "amazon",
          "marketplace": "US",
          "seller_id": "A1B2C3D4E5F6G7"
        },
        {
          "type": "walmart",
          "marketplace": "US",
          "seller_id": "101234567"
        },
        {
          "type": "web",
          "domain": "exampleretail.com"
        }
      ],
      "scope": {
        "territories": [
          "US",
          "CA"
        ],
        "product_lines": [
          "all"
        ]
      },
      "proposed_by": null,
      "expires": "2026-12-22T00:00:00Z"
    }
  ]
}
