{
  "spec": "authorized-retailers/0.1",
  "form": "full",
  "brand": {
    "name": "Example Brand",
    "domain": "brand.example"
  },
  "issued": "2026-09-23T00:00:00Z",
  "expires": "2026-12-22T00:00:00Z",
  "authorizations": [
    {
      "id": "auth_01J9X2",
      "retailer": {
        "name": "Example Retail LLC",
        "entity_id": "ent_7Q4M"
      },
      "channels": [
        {
          "type": "amazon",
          "marketplace": "US",
          "seller_id": "A1B2C3D4E5F6G7"
        },
        {
          "type": "walmart",
          "marketplace": "US",
          "seller_id": "101234567"
        },
        {
          "type": "web",
          "domain": "retailer.example"
        }
      ],
      "scope": {
        "territories": [
          "US",
          "CA"
        ],
        "product_lines": [
          "all"
        ]
      },
      "proposed_by": null,
      "expires": "2026-12-22T00:00:00Z"
    },
    {
      "id": "auth_02",
      "retailer": {
        "name": "Corner Shoes"
      },
      "channels": [
        {
          "type": "ebay",
          "marketplace": "GB",
          "seller_id": "cornershoes"
        },
        {
          "type": "physical",
          "address": "1 High St, London",
          "country": "GB"
        }
      ],
      "scope": {
        "territories": [
          "*"
        ],
        "product_lines": [
          "running",
          "trail"
        ]
      },
      "proposed_by": {
        "name": "Example Distribution Ltd",
        "entity_id": "ent_DIST1"
      },
      "expires": "2026-11-01T00:00:00Z"
    }
  ],
  "signature": {
    "kid": "ar-2026-09",
    "jws": "eyJhbGciOiJFZERTQSIsImtpZCI6ImFyLTIwMjYtMDkifQ..c2lnbmF0dXJlLXBsYWNlaG9sZGVy"
  }
}
